{
  "format": "lachesis-explorer-bundle",
  "schema_version": "2.0",
  "meta": {
    "repository": "demo/atlas-commerce",
    "language": "typescript",
    "revision": "main",
    "lines": 28416,
    "indexed_nodes": 20,
    "fixture": true
  },
  "graph": {
    "capabilities": ["calls", "imports", "data-flow", "source-snippets"],
    "coverage": {
      "scope": "repository",
      "included_nodes": 8,
      "indexed_nodes": 20,
      "limitations": ["Generated files are omitted from this working projection."]
    },
    "files": [
      {"id": "file.search", "path": "src/routes/search.ts", "module": "search", "language": "typescript", "lines": 142},
      {"id": "file.service", "path": "src/search/search-service.ts", "module": "search", "language": "typescript", "lines": 188},
      {"id": "file.query", "path": "src/search/query.ts", "module": "search", "language": "typescript", "lines": 76}
    ],
    "modules": [
      {"id": "module.search", "name": "Search", "path": "src/search", "node_ids": ["route.search", "parse.query", "normalize.query", "search.service", "search.query"]}
    ],
    "nodes": [
      {"id": "route.search", "kind": "route", "file": "src/routes/search.ts", "line": 24, "label": "POST /api/search", "qualified_name": "routes.search.post", "module": "search", "signature": "async function post(request)", "snippet": "export async function POST(request: Request)"},
      {"id": "parse.query", "kind": "function", "file": "src/routes/search.ts", "line": 31, "label": "parseSearchRequest", "qualified_name": "routes.search.parseSearchRequest", "module": "search", "signature": "parseSearchRequest(request)", "snippet": "const input = await parseSearchRequest(request)"},
      {"id": "normalize.query", "kind": "function", "file": "src/search/query.ts", "line": 18, "label": "normalizeQuery", "qualified_name": "search.query.normalizeQuery", "module": "search", "signature": "normalizeQuery(input)", "snippet": "return normalizeQuery(input.query)"},
      {"id": "search.service", "kind": "method", "file": "src/search/search-service.ts", "line": 42, "label": "SearchService.find", "qualified_name": "SearchService.find", "module": "search", "signature": "find(query, options)", "snippet": "return this.searchService.find(query, options)"},
      {"id": "search.query", "kind": "query", "file": "src/search/search-service.ts", "line": 86, "label": "buildProductQuery", "qualified_name": "search.buildProductQuery", "module": "search", "signature": "buildProductQuery(query)", "snippet": "return products.where(buildProductQuery(query))"},
      {"id": "search.result", "kind": "function", "file": "src/routes/search.ts", "line": 45, "label": "toSearchResponse", "qualified_name": "routes.search.toSearchResponse", "module": "search", "signature": "toSearchResponse(rows)", "snippet": "return Response.json(toSearchResponse(rows))"},
      {"id": "catalog.client", "kind": "class", "file": "src/catalog/client.ts", "line": 12, "label": "CatalogClient", "qualified_name": "catalog.CatalogClient", "module": "catalog", "snippet": "class CatalogClient {"},
      {"id": "db.products", "kind": "effect", "file": "src/catalog/client.ts", "line": 64, "label": "products.query", "qualified_name": "CatalogClient.products.query", "module": "catalog", "snippet": "return db.products.query(statement)"}
    ],
    "edges": [
      {"source": "route.search", "target": "parse.query", "relation": "calls"},
      {"source": "parse.query", "target": "normalize.query", "relation": "calls"},
      {"source": "normalize.query", "target": "search.service", "relation": "calls"},
      {"source": "search.service", "target": "search.query", "relation": "calls"},
      {"source": "search.service", "target": "catalog.client", "relation": "uses"},
      {"source": "catalog.client", "target": "db.products", "relation": "queries"},
      {"source": "search.service", "target": "search.result", "relation": "returns"}
    ],
    "entrypoints": [
      {"id": "entry.search", "label": "POST /api/search", "kind": "http", "node_id": "route.search", "file": "src/routes/search.ts"}
    ]
  },
  "paths": {
    "requests": [
      {"id": "request.search", "entry": "POST /api/search", "entry_node": "route.search", "hops": [
        {"node_id": "route.search", "edge_label": "calls", "caption": "receives request"},
        {"node_id": "parse.query", "edge_label": "calls", "caption": "parses input"},
        {"node_id": "normalize.query", "edge_label": "calls", "caption": "normalizes query"},
        {"node_id": "search.service", "edge_label": "calls", "caption": "runs search"},
        {"node_id": "db.products", "edge_label": "queries", "caption": "reads catalog"}
      ]}
    ],
    "values": [
      {"id": "value.search-query", "name": "search query", "steps": [
        {"node_id": "parse.query", "role": "source"},
        {"node_id": "normalize.query", "role": "transforms"},
        {"node_id": "search.query", "role": "used by"}
      ]}
    ]
  },
  "security": {"findings": []}
}
